{"ephemeralKey":"BM-a0II-vszXhhb34BFqecdDnvw3xnveAVxkGYNNx6huJOLUYbhIlYilcAE-ps-GTnPod7OwOamV0DguK2DAXzI","route":{"kind":"pod.create","deviceId":"7a7d54a6-3c8c-4b1c-a1d7-80b5c74b5004","minor":0,"kindVersion":1,"major":1,"runtimeId":"7a7d54a6-3c8c-4b1c-a1d7-80b5c74b5002","keyEpoch":1,"direction":"command","issuedAt":"2026-09-20T12:00:00.000Z","protocol":"pods-mobile","generation":"7a7d54a6-3c8c-4b1c-a1d7-80b5c74b5003","sequence":"0","expiresAt":"2026-09-20T12:05:00.000Z","id":"7a7d54a6-3c8c-4b1c-a1d7-80b5c74b5001","owner":{"issuer":"https:\/\/id.example","subject":"owner@example.test"}},"ciphertext":"EZgf7n9KupSoNeFH04Fz17_Ia0xjykfzBMhoWPNwL2cLhMc8ypEsPSYZsEs","nonce":"lBUKXfJfFmPxKzII","signature":"fbyoheUKwHnt9BelLUBSLZzhT3qUPcCOV7t0pavJCtQ8Ahe5dDWRYu7gD3xHsEXQHnSZnidNqlR-YuQOD3utlg","contentMode":"encrypted-v1"}